{
  "schema_version": "os_display_diagnostic_summary.v0",
  "summary_id": "os_display_diag_source_static_contract",
  "route_id": "diagnostic_surfaces.source_static.os_display_contract",
  "generated_at": "2026-06-23T00:00:00Z",
  "target_surface_class": "projection_visual_operator_surface",
  "route_local_url_class": "route_local_url_not_published",
  "chrome_start_or_confirm_class": "chrome_not_running_started_to_route_local_url",
  "chrome_start_to_route_local_surface_elapsed_ms_bucket": "not_measured",
  "foreground_window_class": "foreground_unavailable_without_capture",
  "route_window_focus_class": "focus_unknown",
  "operator_surface_class": "operator_surface_open_not_confirmed",
  "prompt_or_warning_present_class": "prompt_status_unknown_without_capture",
  "permission_prompt_class": "browser_permission_prompt_requires_live_os_route",
  "window_count_class": "window_count_unknown",
  "non_route_window_risk_class": "unknown_without_capture",
  "private_window_sweep_class": "not_performed",
  "capture_scope_class": "none_source_static",
  "capture_method_class": "source_static_schema",
  "max_duration_ms": 0,
  "max_still_count": 0,
  "raw_screenshot_retained": false,
  "raw_screen_recording_retained": false,
  "local_only_artifact_count": 0,
  "retention_deletion_group": "none_source_static",
  "cleanup_owner_class": "rr003_primary_future_live_route",
  "review_owner_class": "testqa_security_before_live_capture",
  "artifact_shareability": "summary_ok",
  "proof_ceiling": "source_static_os_display_diagnostic_contract_only",
  "does_not_prove": [
    "not_screen_capture",
    "not_os_prompt_observation_proof",
    "not_browser_visible_avatar_motion",
    "not_user_heard_audio",
    "not_home_assistant_action",
    "not_raw_media_publication"
  ],
  "raw_private_publication_flags": false
}
